{
    "$schema": "https://json-schema.org/draft/2020-12/schema",
    "title": "Phoenix Physics Collision Layer Matrix",
    "description": "Shape of project/Config/Physics/layers.json. Shape only: matrix symmetry, completeness, contiguous indices and the reserved index 0 are relations between entries. tools/validation/validate_registries.py enforces those.",
    "type": "object",
    "required": ["version", "maxLayers", "layers", "collidesWith"],
    "properties": {
        "$comment": { "type": "string" },
        "version": { "type": "integer", "minimum": 1 },
        "maxLayers": {
            "type": "integer",
            "const": 64,
            "description": "AzPhysics::CollisionLayers::MaxCollisionLayers at O3DE tag 2605.0. Pinned as a constant so an engine upgrade that changes it fails this schema instead of silently widening the allowed index range."
        },
        "layers": {
            "type": "array",
            "minItems": 1,
            "items": {
                "type": "object",
                "required": ["name", "index", "reserved", "description"],
                "properties": {
                    "name": { "type": "string", "pattern": "^[A-Z][A-Za-z0-9]*$" },
                    "index": { "type": "integer", "minimum": 0, "maximum": 63 },
                    "reserved": { "type": "boolean" },
                    "description": { "type": "string", "minLength": 10 }
                },
                "additionalProperties": false
            }
        },
        "collidesWith": {
            "type": "object",
            "description": "Layer name to the layers it collides with. Must be symmetric and name every layer.",
            "additionalProperties": {
                "type": "array",
                "items": { "type": "string", "pattern": "^[A-Z][A-Za-z0-9]*$" },
                "uniqueItems": true
            }
        }
    },
    "additionalProperties": false
}
